<?xml version="1.0" encoding="UTF-8" standalone="yes"?>
<papers xmlns:xsi="http://www.w3.org/2001/XMLSchema-instance"
        xmlns="urn:Test.titlespace"
        xsi:schemaLocation="http://www.example.com/papers.xsd">
    <newspaper id="1" title="Weekly Newspaper">
        <monthly>false</monthly>
        <color>true</color>
        <volume>200</volume>
        <subscription-index>12445800</subscription-index>
        <first-publication>1970-12-12</first-publication>
    </newspaper>
	
    <magazine id="2" title="Some magazine">
        <monthly>true</monthly>
        <color>true</color>
        <gloss>true</gloss>
        <volume>300</volume>
        <subscription-index>65827465</subscription-index>
        <first-publication>2015-08-04</first-publication>
    </magazine>
	
    <booklet id="3" title="OSTIS booklet">
        <monthly>false</monthly>
        <color>true</color>
        <volume>5</volume>
        <gloss>false</gloss>
        <first-publication>2011-02-17</first-publication>
    </booklet>
</papers>